{"$schema":"https://json-schema.org/draft/2020-12/schema","additionalProperties":false,"properties":{"accepted_diagnostic":{"type":"object"},"action_root_projection":{"type":"object"},"artifact_kind":{"const":"qk_gbfp8_g16_base_cardinality_one_execution_authority_static_v3_action_root_freeze"},"authority_controller":{"type":"object"},"authority_package_id":{"const":"QK_GBFP8_G16_BASE_CARDINALITY_ONE_AUTHORITY_STATIC_V3"},"authority_review_requirement":{"type":"object"},"base_lane":{"type":"object"},"checkpoint_176_policy":{"type":"object"},"claim_boundary":{"type":"object"},"consumption_protocol":{"type":"object"},"credential_schema":{"type":"object"},"failure_semantics":{"type":"object"},"freeze_state":{"const":"STATIC_FROZEN_BASE_ONLY_NO_LIVE_AUTHORITY_OR_CREDENTIAL"},"namespaces":{"type":"object"},"preserved_dependencies":{"type":"object"},"publication_protocol":{"type":"object"},"schema_version":{"const":4},"schemas":{"type":"object"},"static_verification":{"type":"object"},"static_verifier":{"type":"object"}},"required":["accepted_diagnostic","action_root_projection","artifact_kind","authority_controller","authority_package_id","authority_review_requirement","base_lane","checkpoint_176_policy","claim_boundary","consumption_protocol","credential_schema","failure_semantics","freeze_state","namespaces","preserved_dependencies","publication_protocol","schema_version","schemas","static_verification","static_verifier"],"schema_id":"QK_GBFP8_G16_BASE_CARDINALITY_ONE_AUTHORITY_STATIC_V3_PACKAGE_SCHEMA","type":"object"}
