{"accepted_diagnostic":{"artifacts":{"contract":{"byte_count":19997,"path":"design/QK_GBFP8_G16_HEAD64_SUCCESSOR_DIAGNOSTIC_STATIC_V1_CONTRACT.json","sha256":"d80dab5c2909e6c6f163e3227a9a2c99d7a4c997c3408d5fb91ebc6087707b08"},"no_execution_proof":{"byte_count":1585,"path":"reference/QK_GBFP8_G16_HEAD64_SUCCESSOR_DIAGNOSTIC_STATIC_V1_NO_EXECUTION_PROOF.json","sha256":"4544873432051ae92e69d468ec63b1e54acd881ca40574f777cef1a719dd7356"},"reference_evaluator":{"byte_count":43080,"path":"reference/qk_gbfp8_g16_head64_successor_diagnostic_static_v1.py","sha256":"20e3f4fc891a7a75f2204662c1107a57319f665deafa3de12dfa3ea851d83dbe"},"result_schema":{"byte_count":19082,"path":"reference/QK_GBFP8_G16_HEAD64_SUCCESSOR_DIAGNOSTIC_STATIC_V1_SCHEMA.json","sha256":"8d512af26bf39593236098f850ae5477ae13343ffbdeac4fbb207b1b8fd71840"},"static_verifier":{"byte_count":68930,"path":"tools/verify_qk_gbfp8_g16_head64_successor_diagnostic_static_v1.py","sha256":"bf2bb603a8919b0abb4f0bcdbfc34c278d451945f3bfb34cbc0807b478795f0c"}},"contract_id":"QK_GBFP8_G16_HEAD64_SUCCESSOR_DIAGNOSTIC_STATIC_V1","evaluator_id":"QK_GBFP8_G16_HEAD64_SUCCESSOR_DIAGNOSTIC_EVALUATOR_V1","fresh_l2_handoff":{"byte_count":956,"mission_id":"e14110288e39","path":"/home/argustest/.argus-skill-ace2/projects/s-c8ae985b/handoffs/e14110288e39/round-0005.json","sha256":"8ce378215be3a55dd50432a3d9f301501133d817e5e343d53929f1fe0eaa4c83","status":"done"},"package":{"byte_count":2132,"path":"reference/QK_GBFP8_G16_HEAD64_SUCCESSOR_DIAGNOSTIC_STATIC_V1_PACKAGE.json","sha256":"33c42fe340867f5b89d451339ca2d552f0bfec3309d8a6103066c171d7806513"},"package_id":"QK_GBFP8_G16_HEAD64_SUCCESSOR_DIAGNOSTIC_STATIC_V1_PACKAGE","result_schema_id":"QK_GBFP8_G16_HEAD64_SUCCESSOR_DIAGNOSTIC_RESULT_V1","sidecar":{"byte_count":130,"path":"reference/QK_GBFP8_G16_HEAD64_SUCCESSOR_DIAGNOSTIC_STATIC_V1_PACKAGE.json.sha256","sha256":"f34a6490bac2aa2a04cdad6f6bdfb60180ca0c969fee98d5d9256fbd4e913221"},"task_mission":{"byte_count":3068,"mission_id":"e14110288e39","path":"/home/argustest/.argus-skill-ace2/projects/s-c8ae985b/handoffs/e14110288e39/mission.json","sha256":"4ade4802aaf647c731a417627c94f60963254cb127760aded233cf3439f06e9e"}},"action_root_projection":{"absolute_root":"/home/argustest/ace-2/reference/qk_gbfp8_g16_base_cardinality_one_authority_static_v3_action_root","accepted_dependency_projection":[{"byte_count":19997,"projected_path":"design/QK_GBFP8_G16_HEAD64_SUCCESSOR_DIAGNOSTIC_STATIC_V1_CONTRACT.json","sha256":"d80dab5c2909e6c6f163e3227a9a2c99d7a4c997c3408d5fb91ebc6087707b08","source_path":"design/QK_GBFP8_G16_HEAD64_SUCCESSOR_DIAGNOSTIC_STATIC_V1_CONTRACT.json"},{"byte_count":19517,"projected_path":"design/QK_GROUPED_BFP8_HEAD64_SUCCESSOR_STATIC_V1_CONTRACT.json","sha256":"64a7d1efce2336721a81be7e8319b1740cebad2449ac44ea29ca1007d2e5b549","source_path":"design/QK_GROUPED_BFP8_HEAD64_SUCCESSOR_STATIC_V1_CONTRACT.json"},{"byte_count":20057,"projected_path":"evidence/diagnostics/w4a8-c02-attention-substage-trace-v2/base/result.json","sha256":"4d5904378b9ccbabd434119b6a57f8d4266abf3d8e772c4c1bca98df785e7f3a","source_path":"evidence/diagnostics/w4a8-c02-attention-substage-trace-v2/base/result.json"},{"byte_count":33568,"projected_path":"reference/QK_BFP8_E16_HEAD64_V1_C02_SCORE_PATH_EVALUATION_PACKAGE.json","sha256":"0bd51407f20950a93f47a520718a3bb4d5a5006d990d60aef626d16a5f9d976d","source_path":"reference/QK_BFP8_E16_HEAD64_V1_C02_SCORE_PATH_EVALUATION_PACKAGE.json"},{"byte_count":1585,"projected_path":"reference/QK_GBFP8_G16_HEAD64_SUCCESSOR_DIAGNOSTIC_STATIC_V1_NO_EXECUTION_PROOF.json","sha256":"4544873432051ae92e69d468ec63b1e54acd881ca40574f777cef1a719dd7356","source_path":"reference/QK_GBFP8_G16_HEAD64_SUCCESSOR_DIAGNOSTIC_STATIC_V1_NO_EXECUTION_PROOF.json"},{"byte_count":2132,"projected_path":"reference/QK_GBFP8_G16_HEAD64_SUCCESSOR_DIAGNOSTIC_STATIC_V1_PACKAGE.json","sha256":"33c42fe340867f5b89d451339ca2d552f0bfec3309d8a6103066c171d7806513","source_path":"reference/QK_GBFP8_G16_HEAD64_SUCCESSOR_DIAGNOSTIC_STATIC_V1_PACKAGE.json"},{"byte_count":130,"projected_path":"reference/QK_GBFP8_G16_HEAD64_SUCCESSOR_DIAGNOSTIC_STATIC_V1_PACKAGE.json.sha256","sha256":"f34a6490bac2aa2a04cdad6f6bdfb60180ca0c969fee98d5d9256fbd4e913221","source_path":"reference/QK_GBFP8_G16_HEAD64_SUCCESSOR_DIAGNOSTIC_STATIC_V1_PACKAGE.json.sha256"},{"byte_count":19082,"projected_path":"reference/QK_GBFP8_G16_HEAD64_SUCCESSOR_DIAGNOSTIC_STATIC_V1_SCHEMA.json","sha256":"8d512af26bf39593236098f850ae5477ae13343ffbdeac4fbb207b1b8fd71840","source_path":"reference/QK_GBFP8_G16_HEAD64_SUCCESSOR_DIAGNOSTIC_STATIC_V1_SCHEMA.json"},{"byte_count":1422,"projected_path":"reference/QK_GROUPED_BFP8_HEAD64_SUCCESSOR_STATIC_V1_PACKAGE.json","sha256":"d6e4969660de746f7123b29e80f49febcf18fdeca8ffab234f4849a8dd8feea8","source_path":"reference/QK_GROUPED_BFP8_HEAD64_SUCCESSOR_STATIC_V1_PACKAGE.json"},{"byte_count":2405,"projected_path":"reference/QK_GROUPED_BFP8_HEAD64_SUCCESSOR_STATIC_V1_SCHEMA.json","sha256":"6dcda9692926962d5888fcb1ff99bf4f695d2cc8740d06a61b4b19c93cde2ef3","source_path":"reference/QK_GROUPED_BFP8_HEAD64_SUCCESSOR_STATIC_V1_SCHEMA.json"},{"byte_count":43080,"projected_path":"reference/qk_gbfp8_g16_head64_successor_diagnostic_static_v1.py","sha256":"20e3f4fc891a7a75f2204662c1107a57319f665deafa3de12dfa3ea851d83dbe","source_path":"reference/qk_gbfp8_g16_head64_successor_diagnostic_static_v1.py"},{"byte_count":16821,"projected_path":"reference/qk_grouped_bfp8_head64_successor_static_v1.py","sha256":"f3a5ebcff18403c048f2b279b5af2e56acaa7f551e68bfb2c475b418ce27140f","source_path":"reference/qk_grouped_bfp8_head64_successor_static_v1.py"},{"byte_count":32001,"projected_path":"tools/qk_bfp8_e16_head64_v1_c02_score_path_evaluator_v2.py","sha256":"f27b8662d0137b2c9ca9dc8d977c0b6b6d953c62554658f0e0e3f19d9527d521","source_path":"tools/qk_bfp8_e16_head64_v1_c02_score_path_evaluator_v2.py"},{"byte_count":49140,"projected_path":"tools/verify_qk_bfp8_e16_head64_v1_c02_score_path_evaluation_package.py","sha256":"701bdf27b8a412956ed8b1fb2a34edde8a6a5dff1aedc68010f0dd69ba0beb49","source_path":"tools/verify_qk_bfp8_e16_head64_v1_c02_score_path_evaluation_package.py"},{"byte_count":68930,"projected_path":"tools/verify_qk_gbfp8_g16_head64_successor_diagnostic_static_v1.py","sha256":"bf2bb603a8919b0abb4f0bcdbfc34c278d451945f3bfb34cbc0807b478795f0c","source_path":"tools/verify_qk_gbfp8_g16_head64_successor_diagnostic_static_v1.py"},{"byte_count":22056,"projected_path":"tools/verify_qk_grouped_bfp8_head64_successor_static_v1.py","sha256":"18378125fcc96e38c15be30dca75843caaa384f2beb01f917646df9ea89ac4e6","source_path":"tools/verify_qk_grouped_bfp8_head64_successor_static_v1.py"}],"action_root_id":"qk-gbfp8-g16-base-cardinality-one-authority-static-v3-action-root","evaluator_argv_exactly_accepted":true,"namespace_separation":"All accepted V1-relative evaluator paths resolve beneath this distinct V3 action root, never beneath the closed repository-root V1 action.","sealed_tensor_materialized":false,"sealed_tensor_runtime_byte_count":1305797,"sealed_tensor_runtime_path":"evidence/diagnostics/w4a8-c02-attention-substage-trace-v2/base/attention-substage-tensors.bin","sealed_tensor_runtime_sha256":"7cd2bbdbe611fdfce4d2cae66f6f20a43685087a35ce05c26c82d96749662175","source_repository_root":"/home/argustest/ace-2","static_template_state":"STATIC_DEPENDENCIES_PROJECTED_SEALED_PAYLOAD_SLOT_ABSENT"},"artifact_kind":"qk_gbfp8_g16_base_cardinality_one_execution_authority_static_v3_action_root_freeze","authority_controller":{"argv_template":["/home/argustest/miniconda3/bin/python3.13","-I","-B","reference/qk_gbfp8_g16_base_cardinality_one_authority_controller_static_v3.py","--authority-package","reference/QK_GBFP8_G16_BASE_CARDINALITY_ONE_AUTHORITY_STATIC_V3_PACKAGE.json","--authority","build/qk-gbfp8-g16-head64-successor-diagnostic-v1-authority/base/authority.json","--credential","build/qk-gbfp8-g16-head64-successor-diagnostic-v1-authority/base/credential.json","--fresh-l2-review","{fresh_l2_review_path}","--irreversible-action-id","{irreversible_action_id}","--first-terminal","build/qk-gbfp8-g16-head64-successor-diagnostic-v1-authority/base/first-terminal.json"],"byte_count":38204,"controller_id":"QK_GBFP8_G16_BASE_CARDINALITY_ONE_AUTHORITY_CONTROLLER_STATIC_V3","environment":{"LANG":"C","LC_ALL":"C","PYTHONHASHSEED":"0","TZ":"UTC"},"evaluator_argv":["/home/argustest/miniconda3/bin/python3.13","-I","-B","reference/qk_gbfp8_g16_head64_successor_diagnostic_static_v1.py","--package","reference/QK_GBFP8_G16_HEAD64_SUCCESSOR_DIAGNOSTIC_STATIC_V1_PACKAGE.json","--authority","build/qk-gbfp8-g16-head64-successor-diagnostic-v1-authority/base/authority.json","--ledger","build/qk-gbfp8-g16-head64-successor-diagnostic-v1-authority/base/authority-ledger.json","--lane","Base","--metadata","evidence/diagnostics/w4a8-c02-attention-substage-trace-v2/base/result.json","--tensor-bundle","evidence/diagnostics/w4a8-c02-attention-substage-trace-v2/base/attention-substage-tensors.bin","--output","build/qk-gbfp8-g16-head64-successor-diagnostic-v1/base/result.json"],"execution_state":"NOT_EXECUTED","implementation":"CPython","interpreter_path":"/home/argustest/miniconda3/bin/python3.13","interpreter_sha256":"fd4487ad3503b1aff61919108fd6f4f63c4245169fe9275f7c2ab76a1a53d3ad","path":"reference/qk_gbfp8_g16_base_cardinality_one_authority_controller_static_v3.py","python_version":"3.13.5","sha256":"6ed2018a28d3a369a3dea8af6ac9ac6e729ccdb9e08159f4cce62ef34d54b1fa"},"authority_package_id":"QK_GBFP8_G16_BASE_CARDINALITY_ONE_AUTHORITY_STATIC_V3","authority_review_requirement":{"acceptance_state":"FUTURE_EXTERNAL_BINDING_REQUIRED","handoff_directory":"/home/argustest/.argus-skill-ace2/projects/s-c8ae985b/handoffs/f7b9464aa8ca","mission":{"byte_count":3943,"mission_id":"f7b9464aa8ca","path":"/home/argustest/.argus-skill-ace2/projects/s-c8ae985b/handoffs/f7b9464aa8ca/mission.json","sha256":"a20ee7d5e71093ba979aa9f7f61b892e90f3d75409c968d6637337b52c76b45e"},"mission_id":"f7b9464aa8ca","mission_p